1289,Relation-Commerciale,"Accueil très agréable et c'est la seule chose que je retiendrais. Prise en charge, après un certain temps d'attente, par un vendeur au service client plus que détestable, pas d'écoute des demandes, des explications plus que médiocres sur les différents téléphones proposés et quand on demande de voir le téléphone, enfin choisi, je trouve assez dommage que la réponse donnée soit ""il est au fond présenté "" sans que le vendeur daigne se déplacer... Je voulais pourtant changer de téléphone. Je suis reparti sans...  Je ne remettrai plus les pieds dans cette boutique."
807,Relation-Commerciale,"D'une incompétence incroyable et d'un amabilité déplorable. C'est la troisième fois que je m'y rend en tant que pro, et c'est la troisième fois qu'ils n'ont  pas ce qu'il faut: carte SIM, box Orange... Et ils ne peuvent soit disant aps appeler un autre boutique Orange pour vérifier que le matériel soit en stock là bas..."
687,Problème-Technique,No pueden solucionar ningún problema con SIM CARDS que pertenecen a ellos. Malísima la atención!
976,Accueil-politesse,Excellent accueil mais surtout grande disponibilité des vendeurs et grandes compétences dans le domaine technique. Boutique dont le fonctionnement est hors du commun.
636,Temps-Attente,"Service deplorable. Je me rends en boutique pour échanger une box défectueuse. J'ai commandé la box de remplacement en ligne et reçu une notification comme quoi elle était arrivée.  J'ai attendu 30 minutes en boutique pour qu'un personnel malpoli m'explique que mon colis n'est pas arrivé. Selon lui, si j'ai reçu un SMS comme quoi le colis est arrivé aujourd'hui, c'est qu'il arrivera demain. Sa logique me dépasse."
2029,Accueil-politesse,Bon vendeurs à l'écoute et sympathique.
1512,Temps-Attente,Personnel super compétent très peu d’attente j’ai rien à dire autre chose que allez y les yeux fermés
2219,Accueil-politesse,orange opéra beaucoup mieux que orange champ Élysée j'avais l'impression de parler à un mûr je parlais tout seul !!!
663,Accueil-politesse,Le personnel est vraiment TRÈS désagréable ! C’est la pire boutique Orange. Ils font pas leur travail ils ont que le mot NON dans leur bouche à croire qu’il nous rendent service !
1842,Relation-Commerciale,"Suite à l'achat d'un film verre (cache) XPERIA, je vais à la boutique pour la 3ème fois,  vers les 18h ce mercerdi ,afin de rencontrer Le responsable qui est en entretien tél,  l'un des vendeurs me dit de revenir ds 1/4 , après je le croise dans le magasin il faisait l'inventaire, c'est tout juste si moi j'allais pas prendre aussi ma douche !!! Il me bloque cache en me disant je ne rembourse rien, je n'avais même ouvert la bouche..il prend même pas la peine d'écouter, aucun respect alors que je me suis adressée au SAV de xpéria, qui m'ont recommandé d'aller en boutique...tout le monde se renvoie la balle, mais pour un responsable il est utile de savoir écouter ou communiquer, maintenant que j'ai croisé le responsable je comprends la bonne humeur de ce magasin...c'est un pti monsieur quelconque d'une 50è d'années voir plus, dégarni et aucuns sourires..Il faisait l'inventaire trop préoccupé par ses responsabilités...Je comprends pourquoi j'ai pas envie de rester chez ORANGE"
427,Problème-Technique,"Cliente comme mon mari depuis des années chez Orange. Je suis très déçue de mon dernier passage. Je suis allée changer mon smartphone qui avait 2 problèmes. La batterie qui n'en pouvait plus, celui que l'on m'a remplacé est guère mieux. Le chargeur aussi a été changé mais on me l'a fait payer presque 15€ alors qu'il fesait parti du pack d'achat. Les photos de mes contacts sont toutes floutees. Je suis très déçue. Je dois le changer au mois d'octobre, j'y réfléchirais. Quand à l'accueil dure, dure. Désolée."
486,Accueil-politesse,"Personnel à l'accueil faisant réellement office d'accueil et de bienvenu... un vrai plaisir d'être accueilli de la sorte avec courtoisie et sourire. Pas eu besoin de passer par la case conseiller donc impossible à juger, mais en tout cas il y avait de nombreux conseiller en train de renseigner des clients. Ça change des boutiques où les îlots de conseils sont désespérément vides..."
1340,Relation-Commerciale,Vendeur très compétent et efficace
1148,Accueil-politesse,Très bien personnels très aimable
448,Accueil-politesse,Suoer sympa les vendeurs !
592,Temps-Attente,Beaucoup d'attente (environ 30 minutes) du fait que les vendeurs soient obligés de dépasser leur rôle et de jouer les pédagogues avec des clients pas très doués... Ils sont vraiment patients... Accueil aimable et professionnel.
872,Accueil-politesse,Équipe Sympa et compétente...
1796,Cadre-Atmosphère,Souvent vide on a l impression de rentrer dans un autre monde froid et inquiétant
2142,Relation-Commerciale,"Après 1,5 mois d'erreurs de mise en place, et de mauvais matériel envoyé, on arrive enfin à avoir la livebox fonctionnant chez nous. On rend notre matériel en agence, et on reçoit ensuite des courriers de mise en demeure de matériel non envoyé car évidemment l'agence ne communique pas avec les autres services. Je retourne à l'agence aujourd'hui, et l'agent accueil me reçoit de manière déplorable : c'est ma faute si j'ai rendu le matériel en agence et pas par Chronopost. Oùest le client ? Pourtant rien ne vous avait été dit la fois précédente. Bref heureusement un responsable est à la rescousse, et a débrouillé l'affaire en prenant du temps, et en faisant son travail. Merci à lui ! Mais quel parcours du combattant pour le client pour juste avoir une livebox."
551,Accueil-politesse,"Je suis rentré puis je suis sortie : Aucun vendeur à ma rencontre ""j'ai poiroté 15 minutes"""
1198,Accueil-politesse,(Traduit par Google) Très bon service  (Original) Muy buen servicio
25,Temps-Attente,"Bel endroit, mais une attente infinie pire qu'une administration."
1482,Emotion-Ressenti,Bien
1111,Emotion-Ressenti,"Accueil un peu poussif et amateurs,  mais gentillesse et politesse"
2507,Accueil-politesse,"Accueil efficace et souriant, pas d'attente, du choix et des rayons remplis, le seul bémol c'est les prix."
1801,Emotion-Ressenti,Excellent  service.
1924,Relation-Commerciale,Top opérateur de grade qualité
2562,Changement-Opérateur,"Client depuis de nombreuses années d'Orange (auparavant PTT, Itinéris, France Télécom, etc...), titulaire un contrat complet à ma résidence principale de Paris et souhaitant changer de fournisseur Internet pour ma résidence secondaire, je me suis rendu - en prenant rendez-vous - à la boutique Orange de la rue de Rennes à Paris pour obtenir des informations et instructions complémentaires. Je fut reçu à l'heure prévue par un conseiller incapable de répondre à toutes mes questions, me regardant avec les yeux mi-clos, visiblement peu intéressé par ma visite. Je lui ai posé une question concernant un problème récurrent que j'ai avec un téléphone Samsung, que j'ai acheté neuf chez Orange. Il n'a pu me répondre qu'il me fallait téléphoner au 3900, sans plus d'explications. J'ai été profondément déçu par le manque de professionnalisme de ce conseiller. J'en ai connu de meilleurs chez Orange !"
1128,Accueil-politesse,"Pire boutique Orange, personnel incompétent et responsable de l’agence qui ne connaît pas le mot “service client” ! Les autres boutiques Orange sont vraiment à la hauteur, alors que celle-ci... Client depuis 2005, je n’ai jamais vécu un pire service avec Orange que dans cette boutique ! Honteux"
1670,Cadre-Atmosphère,"Une boutique classique avec tout la téléphonie mobile,  à 5mn de la gare."
2004,Emotion-Ressenti,(Traduit par Google) Haut  (Original) Top
1106,Problème-Technique,"Une catastrophe! Ne laissez pas votre mobile entre leurs mains, mon galaxy m'a été rendu avec un coup de cutter sur la touche principale! "
611,Accueil-politesse,Très bon accueil
1011,Relation-Commerciale,"Le manager est un énorme enfant de péripatéticienne. Et je pèse mes mots. Vous avez le moindre problème avec votre contrat Orange/Sosh ? C'est donc votre problème et non le sien. Bravo, quel humanisme, quel respect de ses semblables."
1605,Accueil-politesse,"Accueil détestable. Quand mon tour arrive, le conseiller m´ignore un moment avant de venir vers moi sans bonjour ni politesse. Je lui explique rapidement ma situation (assez urgente, je pars à l´étranger et le service client me dit de poser mon matériel en boutique), il me dit qu´il ne peut rien faire, n´écoute meme pas mon cas et bascule carrément dans l´impolitesse en me disant que j´aurais du me renseigner mieux avant de venir et que je n´ai rien compris a ce qu´on m´a dit. Ce comportement méprisant d´ailleurs en partie du au fait que je suis une jf de 25 ans.  Tout simplement désagréable et humiliant. Franchement une honte. J´ai appelé le service client pour le signaler, et ai pu poser mon matériel sans aucun problème au store de République.  Bref je ne parle que pour cet agent, mais son contact client est plus que limite et zéro sens du service."
749,Accueil-politesse,"Déplorable! Le personnel est à  la hauteur de sa réputation! Hautain, désagréable et agressif. Boutique à  éviter à tout prix. L' agent à  l'accueil devrait changer de métier !!!  n"
2408,Relation-Commerciale,"(Traduit par Google) Horrible attentif aux détails, seulement intéressé à faire une vente. Je ne pense pas qu'ils voulaient m'aider car je suis un client prépayé et mon numéro ne venait pas de France. À la fin, j'ai été vendu quelque chose qui ne pouvait pas travailler pour moi et a dû le retourner seulement après avoir cherché l'agent original. Si vous êtes un client français, vous obtiendrez peut-être un meilleur service.  (Original) Horrible attentive to details , only interested in making a sale. I don't think they wanted to help me as I am a prepaid client and my number was not from France . In the end I was sold something that could not work for me and had to return it only after looking for the original agent. If your a French client perhaps you will get better service."
1375,Accueil-politesse,"J'y suis allée hier, pour rien. Vendeurs hautains et pas du tout à l'écoute, mon problème n'a pas été résolu. Qu'on me conseille de me rediriger vers le service client en ligne alors que je me suis déplacée en magasin, c'est juste incompréhensible."
2496,Emotion-Ressenti,Solution rapide et efficace ! Très pros !
1401,Cadre-Atmosphère,Magasin propre accueillant
1373,Accueil-politesse,"Le 25 avril, vers 11h30,Neuf employés dont deux agents de sécurité et un caissier, pour deux clients. Les « techniciens » occupés à bailler ou s’amuser dans un magasin presque vide. Accueil hautain et 20’ d’attente. J’ai fini par partir."
385,Emotion-Ressenti,"Arrivé dès l'ouverture, accueil et service efficace avec sourire. Un vrai petit bonheur."
1196,Relation-Commerciale,"Bonjour à toutes et à tous ,  Fuyez cette boutique comme la peste! Personnel incompétent et se permet d’être négligeable avec sa clientèle.  3 allez retours en boutique suite au professionnalisme de ces incompétents."
1835,Accueil-politesse,Bon accueil et bon service!
1384,Emotion-Ressenti,"Service client parfait. Personnel très à l'écoute de mes besoin et très serviable. Peu d'attente, ça change... Merci à l'équipe !"
2027,Temps-Attente,Trop de monde donc beaucoup d'attente. Mais service correct.
643,Temps-Attente,Attente 1h à 1h30  L ENFER
2388,Temps-Attente,Clairement pas assez de personnes pour traiter les demandes des clients. J'étais passez chez Apple en face on m'a répondu et j'ai pu acheter mon produit sans attendre. Chez Orange il y avait 17 personnes devant moi.
1551,Temps-Attente,Beaucoup beaucoup de monde et donc d'attente. Vendeurs sympathiques et compétents dans l'ensemble car certains sont plutôt mal aimables
1855,Emotion-Ressenti,Il sont très pro et agréable une bonne équipe au service de la clientèle
1534,Relation-Commerciale,Efficace. Rapide.
262,Relation-Commerciale,(Traduit par Google) Désorganisé et incapable de me proposer une recharge pour mon prépayé mobile. Passé 45 minutes en attente de parler à un vendeur qui ne pouvait pas m'aider avec ma requête  (Original) Disorganised and unable to offer me recharge for my pre pay mobile. Spent 45 minutes waiting to talk to a sales man who couldn't help me with my query
31,Emotion-Ressenti,(Traduit par Google) Service excellent. Dedans et dehors!  (Original) Excellent service.  In and out!
13,Problème-Technique,"Passage à la boutique Orange des Champs Elysées, seule boutique apparemment ayant un service de dépannage de smartphones. Prise en charge par un technicien souriant et aimable après 5 mn d'attente, les réparations ont été effectuées après que les explications (claires et précises) m'ont été fournies. Un seul regret : d'apprendre que si une réinitialisation de mon téléphone avait dû être faite, la sauvegarde de toutes mes données m'auraient coûté 9,00 € TTC. Ce qui me choque ce n'est pas tant le faible montant de cette opération, mais le fait que la fidélité du client (près de 10 ans chez Orange) ne compte pas... J'ai connu Orange beaucoup plus attentif à sa clientèle que maintenant. Restons positif pour cette opération. 20 mn plus tard, tout était réglé."
1496,Relation-Commerciale,"(Traduit par Google) J'étais en tournée en Europe pour quelques semaines et ma première nuit était près du magasin orange. Nous sommes allés là-bas, ils m'ont aidé à obtenir une carte sim en anglais pour environ 50 $ qui m'a couvert dans les 6 pays que j'ai traversé. In and out rapidement! Super pour avoir un service cellulaire avec Internet pour nous aider à naviguer notre voyage en Europe!  (Original) I was touring Europe for a couple weeks and my first night was near the orange store. Walked down there, they helped me get a sim card in english for about $50 that covered me in all 6 countries i travelled through. In and out quickly! Great to have cell service with internet to help us navigate our Europe road trip!"
2451,Accueil-politesse,Les vendeurs et vendeuses passent le temps à discuté de la pluie et du beau temps avec le client.
2255,Problème-Technique,"Deplorable , service nul , accueil d un autre temps n ecoute pas son client ne comprends rien. De plus service commercial nul se trompe constement , m ont echange une mauvaise box  ce qui a pour consequence de bloquer 30 personnes au travail !!! Je n ai jamais vu ca le directeur merite d etre limogé. c est pas avec ce genre de service que la France va s en sortir on est reellement sur la mauvaise pente."
745,Emotion-Ressenti,Excellent
2516,Relation-Commerciale,"En boutique et au 3900, j'ai été très bien conseillée et guidée, les conseillers en boutique et techniciens téléphoniques sont serviables et très compétents. Un grand bravo pour vos prestations !!"
184,,Ask for Rachida
720,Cadre-Atmosphère,Bonne boutique
1374,Temps-Attente,Le personnel est sympa..toujours du monde donc il faut prévoir une attente..
629,Accueil-politesse,"Que dire de cet endroit... du personnel, il y en a. Occupé à quoi ? Peut-être à vous faire poireauter messieurs mesdames, en paradant comme des coqs. Il faut prendre rdv pour avoir un renseignement, ok pas de pb. Je reviens, j'attend, d'autres attendent, la mine déconfite. Je demande à l'un d'entre eux, ça fait 3/4 d'heure qu'il est là à attendre. Nous sommes jeudi matin je précise. Et avec tout ça, on vous fait bien sentir qu'il faut être bien sage et poli, personne n'ose protester...! Si au moins c'était une pièce de théâtre, non, c'est du vécu !"
501,Accueil-politesse,Tres accueillant et competant
1972,Accueil-politesse,Très bon accueil !
1519,Accueil-politesse,"Très bon accueil.Boubacar est compétent ,patient ,serviable .Bravo"
2352,Cadre-Atmosphère,Commerciales très serviables et à l'écoute. Très belle boutique en passant
2342,Problème-Technique,Prise en charge rapide et bons conseils
2632,Emotion-Ressenti,boutique à éviter!
475,Temps-Attente,Beaucoup trop d attente
2627,Emotion-Ressenti,Employés déplorables !
1494,Accueil-politesse,"I used Orange Internet service for two months while I was living in Paris. The English customer service is unfortunately very rude. If you don't have your account number ready or cannot quickly pull up your French number, they will get irritated and hang up. I've had several unpleasant conversations."
788,Temps-Attente,Service beaucoup trop lent et incompétents
1746,Emotion-Ressenti,Agréable et efficace je recommande
407,Accueil-politesse,"Très bonne accueil, et bien organisé. On s'occupe rapidement de vous et les agents sont serviable."
2006,Changement-Opérateur,"Très déçu par ce point de vente orange, ENORMEMENT d'attente, pour parfois repartir sans avoir parlé à un vendeur. De nombreux problèmes post visite du à des erreurs effectuées par les vendeurs (erreur volontaire de changement d'adresse, magouille sur le logiciel interne, le vendeur rempli les champs d'inscription à la vitesse de l'éclaire sans prendre le temps de nous expliquer, puis constate avoir fait des erreurs, mais les laissent quand même.. résultat plusieurs semaines de retard sur commande, ou encore 3 jours sans carte SIM après une mauvaise manipulation d'un vendeur etc .. aucune empathie, on nous laisse avec notre problème, CLIENT SUIVANT !!"
1732,Accueil-politesse,"Fuyez cette boutique ! Le personnel est incompétent, les clients ont l'impression de déranger, on vous parle mal ! Le directeur et le vendeur plus âgée (barbe blanche) sont horribles ... Ils n'ont pas envie de faire leur boulot et agressent les clients ! Plus jamais !!!!!!"
1729,Temps-Attente,"C'est une bonne boutique accueillante , mais toujours trop de monde ! "
2458,Emotion-Ressenti,Bon
368,Relation-Commerciale,The store not open on time like they wrote at the door.
1301,Accueil-politesse,"Très très bien accueillis. Superbe Boutique. Des personnes y travaillant très professionnelles, accueillantes, gentilles, souriantes. Très très bien !"
703,Cadre-Atmosphère,trop d'attente le concept du salon n'est guère bien étudié la copie du concept est à revoir
1931,Emotion-Ressenti,Magasin refait a neuf mais.... Vendeur désagréable! J'ai jamais vu ça!  Hautain et je m'en foutisme de l'extrême! On ne reviendra plus. Super image d'Orange ! Si je pouvais mettre une note négative je l'aurai fait! FUYEZ
1206,Accueil-politesse,(Traduit par Google) Les consultants ignorent ma visite à Oranzh! Dégoûtant.  (Original) Consultants ignore my visit to Oranzh! Disgustingly.
2433,Relation-Commerciale,"Pongo una estrella porque no se puede poner menos. El personal no tiene ni idea de lo que tienen en la tienda, te dicen que solo hay un tamaño y había dos, hasta se quedó cortado al darse cuenta. No tienen formación ninguna. Hay 3 personas en la puerta que no se enteran de nada e ignoran las preguntas. Llevamos 15 minutos esperando a por la persona que nos iba a resolver la duda y no volvió."
2270,Emotion-Ressenti,Top des boutiques orange
1390,Accueil-politesse,"Très bon service client, et le problème a été résolu rapidement. Je recommende cette location ! / Really good customer service, and my problem has been quickly resolved. I recommend this shop !"
2524,Relation-Commerciale,Très Professionnels .
1686,Problème-Technique,Quand vous rentrer dans la boutique en expliquant que vous avez pas de prise téléphonique mais que vous pensez avoir la fibre et que vous voulez l'offre avec forfait portable au lieu de vous dire que votre bâtiment n'est pas éligible à la fibre il vous font le dossier et quand vous rentrez chez vous vous apercevez que c'est une box classique malheureusement vous avez signez et êtes obligé d'attendre 1an pour résilier !!!! Donc reflechissez bien avant d'aller la et quitte à faire répéter et ouvrir la boite pour bien vérifier.
1556,Emotion-Ressenti,Equipe de très pro
1313,Accueil-politesse,"Très bonne expérience dans cette boutique : problème résolu instantanément, vendeurs agréables et proposition spontanée d'un téléphone pour remplacer celui que je m'étais fait voler."
2058,Accueil-politesse,Accueil à revoir. 
1509,Accueil-politesse,"Épouvantable accueil, personnel à la limite de l'escroquerie... Je recommande d'aller à la boutique Orange de République."
845,Relation-Commerciale,"Hallucinant un opérateur de téléphone qui n'a pas de numéro de téléphone ! Pauvre monde le fric d'abord, le service ensuite"
1828,Emotion-Ressenti,Superbe boutique. Équipe jeune et dynamique.
1916,Emotion-Ressenti,Super conseil réactif et efficace  Merci à Myriam 😀
856,Relation-Commerciale,Moins de choses que la boutique orange République. Mais service équivalent.
1688,Accueil-politesse,Aimables comme des portes de prison excepté le gentil barbu. On a franchement l'impression de gêner leur partie de candycrush
1114,Temps-Attente,"Une petite boutique, beaucoup de monde et pas beaucoup de personnel. À eviter"
1902,,No comment
